{
  "$schema": "https://json-schema.org/draft/2020-12/schema",
  "$id": "https://github.com/goraxyy/Kehai/tools/marketing/schemas/pipeline.schema.json",
  "title": "Kehai marketing pipeline settings",
  "description": "tools/marketing/pipeline.json: when the pipeline produces and posts, where, what it keeps and for how long. No secrets (those are in .env). The schedules themselves are the n8n workflows' (tools/marketing/n8n).",
  "type": "object",
  "required": ["version", "timezone", "production", "posting", "telegram", "storage", "retention", "long"],
  "additionalProperties": false,
  "properties": {
    "$schema": { "type": "string" },
    "version": { "const": 1 },
    "timezone": { "type": "string", "description": "IANA zone the days and times are in (the owner's), e.g. America/New_York." },
    "production": {
      "type": "object",
      "required": ["shorts_per_week", "pick_day", "min_moments", "retries"],
      "additionalProperties": false,
      "properties": {
        "shorts_per_week": { "type": "integer", "minimum": 1, "maximum": 7 },
        "pick_day": { "$ref": "#/$defs/day", "description": "The day (its 1 a.m. run, or the first run after it that week if the Mac slept through it) the shorts are picked from the last 7 days' shifts, to be approved over the weekend and posted on the next posting days." },
        "min_moments": { "type": "integer", "minimum": 1, "description": "Fewer moments than this in the week: no picks, and the owner is told." },
        "retries": { "type": "integer", "minimum": 0, "maximum": 10, "description": "Times a failed step is tried again (on later runs) before it waits for the owner." }
      }
    },
    "posting": {
      "type": "object",
      "required": ["days", "buffer", "languages", "tiktok", "youtube", "instagram"],
      "additionalProperties": false,
      "properties": {
        "days": { "type": "array", "items": { "$ref": "#/$defs/day" }, "uniqueItems": true, "description": "Days an approved short goes to Buffer's queue (Buffer's own schedule picks the time: Q14)." },
        "buffer": { "type": "array", "uniqueItems": true, "items": { "enum": ["youtube", "instagram", "twitter", "bluesky", "tiktok", "threads", "facebook", "mastodon", "linkedin"] }, "description": "Buffer channels by service (the free plan allows 3: Q9)." },
        "languages": { "type": "array", "minItems": 1, "items": { "enum": ["en", "ru"] }, "description": "Which language's video goes to Buffer (Q16)." },
        "tiktok": { "enum": ["manual", "buffer", "off"], "description": "manual: the file and caption come to Telegram on posting days, posted by hand." },
        "youtube": {
          "type": "object",
          "required": ["categoryId", "privacy", "madeForKids", "notifySubscribers"],
          "additionalProperties": false,
          "properties": {
            "categoryId": { "type": "string", "description": "20 is Gaming." },
            "privacy": { "enum": ["public", "unlisted", "private"] },
            "madeForKids": { "type": "boolean" },
            "notifySubscribers": { "type": "boolean" }
          }
        },
        "instagram": {
          "type": "object",
          "required": ["type", "shouldShareToFeed"],
          "additionalProperties": false,
          "properties": { "type": { "enum": ["reel", "post", "story"] }, "shouldShareToFeed": { "type": "boolean" } }
        }
      }
    },
    "telegram": {
      "type": "object",
      "required": ["max_upload_mb", "preview_scale"],
      "additionalProperties": false,
      "properties": {
        "max_upload_mb": { "type": "number", "minimum": 1, "maximum": 50, "description": "Bots can send files up to 50 MB; bigger ones go as a smaller preview plus a Drive link." },
        "preview_scale": { "type": "number", "minimum": 0.1, "maximum": 1 }
      }
    },
    "storage": {
      "type": "object",
      "required": ["working_gb", "free_floor_gb"],
      "additionalProperties": false,
      "properties": { "working_gb": { "type": "number", "minimum": 1 }, "free_floor_gb": { "type": "number", "minimum": 0.5 } }
    },
    "retention": {
      "type": "object",
      "description": "Q12. With apply false, housekeeping only reports what it would delete.",
      "required": ["apply", "rejected_days", "posted_days", "shots_days", "krec_days", "logs_days"],
      "additionalProperties": false,
      "properties": {
        "apply": { "type": "boolean" },
        "rejected_days": { "type": "integer", "minimum": 0 },
        "posted_days": { "type": "integer", "minimum": 0, "description": "Days after posting (and archiving) that a short's local files go." },
        "shots_days": { "type": "integer", "minimum": 0, "description": "Days after its video is approved or rejected that a shot goes." },
        "krec_days": { "type": "integer", "minimum": 0, "description": "Days after archiving that a .krec goes." },
        "logs_days": { "type": "integer", "minimum": 1 }
      }
    },
    "long": {
      "type": "object",
      "required": ["day", "preview_scale"],
      "additionalProperties": false,
      "properties": {
        "day": { "type": "integer", "minimum": 1, "maximum": 28, "description": "Day of the month the long video for the month before starts." },
        "preview_scale": { "type": "number", "minimum": 0.1, "maximum": 1 }
      }
    }
  },
  "$defs": { "day": { "enum": ["mon", "tue", "wed", "thu", "fri", "sat", "sun"] } }
}
